,id,listing_url,scrape_id,last_scraped,source,name,description,neighborhood_overview,picture_url,host_id,host_url,host_name,host_since,host_location,host_about,host_response_time,host_response_rate,host_acceptance_rate,host_is_superhost,host_thumbnail_url,host_picture_url,host_neighbourhood,host_listings_count,host_total_listings_count,host_verifications,host_has_profile_pic,host_identity_verified,neighbourhood,neighbourhood_cleansed,neighbourhood_group_cleansed,latitude,longitude,property_type,room_type,accommodates,bathrooms,bathrooms_text,bedrooms,beds,amenities,price,minimum_nights,maximum_nights,minimum_minimum_nights,maximum_minimum_nights,minimum_maximum_nights,maximum_maximum_nights,minimum_nights_avg_ntm,maximum_nights_avg_ntm,calendar_updated,has_availability,availability_30,availability_60,availability_90,availability_365,calendar_last_scraped,number_of_reviews,number_of_reviews_ltm,number_of_reviews_l30d,first_review,last_review,review_scores_rating,review_scores_accuracy,review_scores_cleanliness,review_scores_checkin,review_scores_communication,review_scores_location,review_scores_value,license,instant_bookable,calculated_host_listings_count,calculated_host_listings_count_entire_homes,calculated_host_listings_count_private_rooms,calculated_host_listings_count_shared_rooms,reviews_per_month
3601,39746159,https://www.airbnb.com/rooms/39746159,20240923040840,2024-09-23,city scrape,Welcome to your cozy apartment away from home! !,"Welcome to our bright, sunny, quaint, and humble abode!  A warm peaceful clean apartment situated in a lively friendly neighborhood.  Close to shops, restaurants and outdoor farmers markets.  A short cab or bus ride to downtown Athens and the Acropolis.","Our apartment is in a prime downtown location, close to many shops and services including grocery stores, restaurants, drug store, fast food delivery, hair salons,  & outdoor farmers markets, plus a convenience store next door.  It's also a short bus ride or 5 euro cab ride to the ancient center of Monsateraki , Plaka and the base of the Acropolis.  <br />3 sets of bed and bath linens provided in drawer under bed and in storage under sofa bed and chaise.  Hot water breaker to be turned on 15 minutes prior to use and must be turned off once hot water is being used.<br />One of the hostess's lives in the building if guests have any questions.",https://a0.muscache.com/pictures/da29c0bb-1076-4dae-841d-87627185dcf9.jpg,305072695,https://www.airbnb.com/users/show/305072695,Evan,2019-10-28,"Toronto, Canada","Hello !  My wife and I live in Toronto and I have a beautiful, cozy apartment in downtown Athens that’s close to many major sites.  It's in a great location with lots to do close by, public transportation, restaurants, pharmacy, grocery & convenience store withing walking distance.",,,0%,f,https://a0.muscache.com/im/pictures/user/15772c30-edc1-4f1a-a6c5-03f375bc143a.jpg?aki_policy=profile_small,https://a0.muscache.com/im/pictures/user/15772c30-edc1-4f1a-a6c5-03f375bc143a.jpg?aki_policy=profile_x_medium,Kolonos,1,1,"['email', 'phone']",t,t,"Athina, Greece",ΚΟΛΩΝΟΣ,,37.99766,23.71437,Entire rental unit,Entire home/apt,2,1.0,1 bath,1.0,1.0,"[""TV"", ""Kitchen"", ""Elevator"", ""Stove"", ""Oven"", ""Smoke alarm"", ""Heating"", ""Long term stays allowed"", ""Washer"", ""Fire extinguisher"", ""Free street parking"", ""Private entrance"", ""Refrigerator"", ""First aid kit"", ""Iron"", ""Air conditioning"", ""Patio or balcony"", ""Bed linens"", ""Hair dryer"", ""Cooking basics"", ""Hot water"", ""Essentials"", ""Window guards"", ""Shampoo"", ""Dishes and silverware"", ""Extra pillows and blankets"", ""Wifi"", ""Hangers""]",$99.00,2,30,2,2,30,30,2.0,30.0,,t,30,60,90,180,2024-09-23,1,0,0,2019-11-18,2019-11-18,4.0,5.0,2.0,5.0,5.0,5.0,5.0,,f,1,1,0,0,0.02
5435,54251214,https://www.airbnb.com/rooms/54251214,20240923040840,2024-09-23,city scrape,Budget Twin | Pella Inn,"The only Hostel in Athens, where antiquity, modernity, comfort and value all meets in the best location in the city of Athens with the best view of the Acropolis. The rooftop has a direct view of the Acropolis and is perfect for chilling out, having a good time and meeting other travelers.<br /><br />Only 10 minutes to Acropolis on foot!<br />Only 5 minutes to Monastiraki metro station on foot!<br /><br />Free Internet,<br />Reception Is Open 24/24 (No Curfew),<br />Lockers etc",,https://a0.muscache.com/pictures/miso/Hosting-54251214/original/9b39064a-1e2b-49d9-b76c-9ddb5c36118d.jpeg,439206861,https://www.airbnb.com/users/show/439206861,Pella,2022-01-06,,"Pella Inn is situated in the heart of the old town of Athens within walking distance from the famous Acropolis, Monastiraki square and Plaka. The rooms and their balconies have a direct view of the Acropolis, as does the rooftop bar, which is perfect for chilling out, having a good time and meeting other travelers while enjoying the amazing view of the Acropolis and the rest of the city. The nearest metro station, Monastiraki, is only 150 meters away providing easy access to and from the airport, as well as a direct line to the port of Piraeus. The excellent location of Pella Inn gives you immediate access to all the interesting sights of Athens such as the Acropolis, the Ancient Agora, Keramikos, the Olympic Stadium, the National Archaeological Museum, etc. Our friendly staff is always prepared to advise you on how to get around the city, from the tourist sites to places 'off the beaten path'.
",within an hour,100%,100%,f,https://a0.muscache.com/im/pictures/user/3c19233d-1d0d-4cdb-9aab-7b527e64ef3e.jpg?aki_policy=profile_small,https://a0.muscache.com/im/pictures/user/3c19233d-1d0d-4cdb-9aab-7b527e64ef3e.jpg?aki_policy=profile_x_medium,,5,5,"['email', 'phone']",t,t,,ΕΜΠΟΡΙΚΟ ΤΡΙΓΩΝΟ-ΠΛΑΚΑ,,37.977085,23.723873,Private room in hostel,Private room,2,1.0,1 private bath,1.0,2.0,"[""TV"", ""Elevator"", ""Smoke alarm"", ""Heating"", ""Self check-in"", ""Cleaning available during stay"", ""Fire extinguisher"", ""Building staff"", ""First aid kit"", ""Air conditioning"", ""Luggage dropoff allowed"", ""Hair dryer"", ""Hot water"", ""Books and reading material"", ""Essentials"", ""Exterior security cameras on property"", ""Mini fridge"", ""Carbon monoxide alarm"", ""Bathtub"", ""Wifi""]",$60.00,1,365,1,1,365,365,1.0,365.0,,t,6,20,50,290,2024-09-23,1,0,0,2022-03-09,2022-03-09,5.0,5.0,2.0,5.0,5.0,5.0,5.0,0206Κ010Δ0027700,t,5,0,4,1,0.03
7447,811437477846990694,https://www.airbnb.com/rooms/811437477846990694,20240923040840,2024-09-23,city scrape,Urban Loft by Neuvel,"Urban Loft by Neuvel - Cozy & elegant loft in the heart of Athens.<br /> <br />In Kypseli, one of the most historic neighborhoods of old Athens, our Urban Loft, renovated in 2022, was transformed into this comfort loft with an open plan space.<br />A great choice for single travelers, couples, digital nomads and business travelers.",,https://a0.muscache.com/pictures/miso/Hosting-811437477846990694/original/4d759808-1c2c-4fd9-8bde-fc942b552a6d.jpeg,339149910,https://www.airbnb.com/users/show/339149910,Neuvel,2020-02-27,"Athens, Greece",,within an hour,100%,98%,f,https://a0.muscache.com/im/pictures/user/38d8741a-de56-4623-9f53-5fe566984f3f.jpg?aki_policy=profile_small,https://a0.muscache.com/im/pictures/user/38d8741a-de56-4623-9f53-5fe566984f3f.jpg?aki_policy=profile_x_medium,,10,12,"['email', 'phone']",t,t,,ΑΝΩ ΚΥΨΕΛΗ,,38.00340819064257,23.74531003893177,Entire serviced apartment,Entire home/apt,2,1.0,1 bath,0.0,1.0,"[""Private patio or balcony"", ""Pets allowed"", ""Babysitter recommendations"", ""Shower gel"", ""Clothing storage: wardrobe"", ""Kitchen"", ""Wine glasses"", ""Elevator"", ""Oven"", ""Smoke alarm"", ""Coffee maker: Nespresso"", ""Cleaning available during stay"", ""Free washer"", ""Coffee"", ""Fire extinguisher"", ""Breakfast"", ""40 inch HDTV with Netflix"", ""Refrigerator"", ""First aid kit"", ""Iron"", ""Air conditioning"", ""Bed linens"", ""Dedicated workspace"", ""Hair dryer"", ""Cooking basics"", ""Hot water"", ""Essentials"", ""Drying rack for clothing"", ""Hot water kettle"", ""Shampoo"", ""Dishes and silverware"", ""Extra pillows and blankets"", ""Cleaning products"", ""Wifi"", ""Hangers""]",$56.00,1,365,1,2,365,365,1.0,365.0,,t,4,32,62,278,2024-09-23,1,1,0,2024-02-20,2024-02-20,5.0,5.0,2.0,4.0,5.0,4.0,3.0,00001827294,t,3,3,0,0,0.14
10098,1009885058334641093,https://www.airbnb.com/rooms/1009885058334641093,20240923040840,2024-09-23,city scrape,Julian's Apartment Athens,"Welcome to our cozy Athens apartment, where convenience and comfort meet. We're centrally situated, just a stone's throw from the vibrant city center. Need to get around? No problem – we're a mere 3-minute walk from the subway station, ensuring easy access to all of Athens. The central train station is also conveniently close by.<br />Whether your visit to Athens is for business or leisure, our small apartment offers the perfect base for your adventures in this vibrant city!",,https://a0.muscache.com/pictures/hosting/Hosting-U3RheVN1cHBseUxpc3Rpbmc6MTAwOTg4NTA1ODMzNDY0MTA5Mw%3D%3D/original/f42524c2-0819-4888-8f41-1b940eb82fdd.jpeg,471884136,https://www.airbnb.com/users/show/471884136,Θεόδωρος,2022-07-27,,,within an hour,90%,99%,f,https://a0.muscache.com/im/pictures/user/ff7bddd0-49da-43fc-86d8-05ae7c2d6422.jpg?aki_policy=profile_small,https://a0.muscache.com/im/pictures/user/ff7bddd0-49da-43fc-86d8-05ae7c2d6422.jpg?aki_policy=profile_x_medium,,8,10,"['email', 'phone']",t,t,,ΠΛΑΤΕΙΑ ΑΤΤΙΚΗΣ,,37.99312632307889,23.7248426243694,Entire rental unit,Entire home/apt,2,1.0,1 bath,1.0,1.0,"[""Air conditioning"", ""TV"", ""Kitchen"", ""Wifi""]",$35.00,2,365,2,2,365,365,2.0,365.0,,t,0,0,0,121,2024-09-23,7,7,2,2023-11-05,2024-09-05,3.43,4.0,2.86,4.29,2.86,3.14,4.14,01035780291,t,8,8,0,0,0.65
11271,1105564116361851437,https://www.airbnb.com/rooms/1105564116361851437,20240923040840,2024-09-23,city scrape,Spacious apartment featuring a private terrace,"Enjoy happy times with your significant other, your family, or your friends while staying in this lovely spacious (50 sqm) lodging. With brand new appliances, and its own private large terrace, it provides a wonderful setting to unwind and enjoy yourself. It is located in a typical Athenian neighbourhood, Gkyzi, close to the city centre! With only 5 min walk from the bleu metro line, which connects the airport to the harbor, it is the ideal starting point to explore the entire metropolitan area.","The area of Gyzi is a typical Athenian residential area. It is located in the center of Athens while at the same time maintaining the elements of the neighborhood and this is the main contrast that characterizes it. It is one of the areas that when you walk through its streets you look up. Not so much because apartment buildings have some special beauty, but because there is ""life"" there. Behind the colored awnings, in the conversations that can be heard from the open windows, in the spread clothes that add extra color to the balconies. It has several squares and gathering places that gives it vitality.<br /><br />It is close to the Athens University of Economics and Business and is bordered by Pedion Areos, which is the largest public park in Athens with the Alsos theatre within. The Pedion tou Areos, meaning Field of Ares, was designed in 1934 and its purpose was to honor the heroes of the Greek Revolution of 1821, 21 of whom are depicted in marble busts standing in the park. Here pe",https://a0.muscache.com/pictures/miso/Hosting-1105564116361851437/original/57e4f127-6bec-4166-9e3c-5c3b24967948.jpeg,89859710,https://www.airbnb.com/users/show/89859710,Manolis,2016-08-14,"Central Athens Regional Unit, Greece","Dear guests 

Our goal is to provide you with high-quality accommodation services in our fully renovated apartments 

We also love to travel and therefore we see your stay as if it was ours 

I m Manos, the owner of the company, but your contact person will be Georgia, who is going to help you throughout your stay

Finally, Panagiotis is our ""go getter"" guy who will be present if anything out of the ordinary occurs

Enjoy your stay 

 ",within an hour,100%,100%,t,https://a0.muscache.com/im/pictures/user/337ddee4-d1cb-437b-b894-4a38f3d29d45.jpg?aki_policy=profile_small,https://a0.muscache.com/im/pictures/user/337ddee4-d1cb-437b-b894-4a38f3d29d45.jpg?aki_policy=profile_x_medium,,27,27,"['email', 'phone']",t,t,"Athina, Greece",ΓΚΥΖΗ,,37.9895481,23.7486044,Entire condo,Entire home/apt,4,1.0,1 bath,1.0,2.0,"[""Freezer"", ""Clothing storage: wardrobe and dresser"", ""Private patio or balcony"", ""Shower gel"", ""Kitchen"", ""Wine glasses"", ""Elevator"", ""42 inch HDTV"", ""Heating - split type ductless system"", ""Smoke alarm"", ""Body soap"", ""Ethernet connection"", ""Outdoor furniture"", ""Self check-in"", ""Long term stays allowed"", ""Coffee maker: espresso machine, french press, Nespresso"", ""Coffee"", ""Fire extinguisher"", ""Teka electric stove"", ""Free street parking"", ""Iron"", ""First aid kit"", ""Toaster"", ""Bed linens"", ""Dining table"", ""Hair dryer"", ""Room-darkening shades"", ""Cleaning products"", ""AC - split type ductless system"", ""Hot water"", ""Cooking basics"", ""Microwave"", ""Essentials"", ""Lockbox"", ""Drying rack for clothing"", ""Hot water kettle"", ""Shampoo"", ""Single level home"", ""Dishes and silverware"", ""Extra pillows and blankets"", ""Free washer \u2013 In unit"", ""Wifi"", ""Hangers""]",$38.00,1,90,1,2,90,90,2.0,90.0,,t,2,3,33,308,2024-09-23,3,3,0,2024-04-03,2024-06-17,3.67,4.0,2.67,4.67,3.67,4.67,3.33,00002591940,t,21,21,0,0,0.52
12644,1171051755809038489,https://www.airbnb.com/rooms/1171051755809038489,20240923040840,2024-09-23,city scrape,Haris 302 by VPN Accomodation,"This cozy appartment is located in the heart of Historical Center of Athens (Plaka), in front of the small byzantine church “Kapnikarea” and within a 2 minute’s walk from a main Monastiraki Metro station, the “Tower of the Winds” and the “Library of Hadrian”. Close to the Acropolis, Monastiraki, Psiri, Thissio, the Ancient Agora and Syntagma. The nearby train, bus and tram stations provide easy transportation to everywhere you want to go.",,https://a0.muscache.com/pictures/miso/Hosting-1171051755809038489/original/5a6b36eb-ff3f-4b63-af6a-8cd3bfe6e47f.jpeg,581314884,https://www.airbnb.com/users/show/581314884,Σωτήριος Ναούμ,2024-06-03,,,within an hour,100%,100%,f,https://a0.muscache.com/im/pictures/user/44b23eef-aa56-4b0b-afdc-020abf583abe.jpg?aki_policy=profile_small,https://a0.muscache.com/im/pictures/user/44b23eef-aa56-4b0b-afdc-020abf583abe.jpg?aki_policy=profile_x_medium,,2,2,"['email', 'phone']",t,t,,ΕΜΠΟΡΙΚΟ ΤΡΙΓΩΝΟ-ΠΛΑΚΑ,,37.9813561,23.7250377,Entire rental unit,Entire home/apt,2,1.0,1 bath,1.0,1.0,"[""Air conditioning"", ""Exterior security cameras on property"", ""TV"", ""Kitchen"", ""Wifi""]",$120.00,1,365,1,2,365,365,1.4,365.0,,t,18,48,78,225,2024-09-23,1,1,1,2024-09-19,2024-09-19,4.0,5.0,1.0,2.0,5.0,3.0,3.0,00002661028,t,2,2,0,0,1.0
12750,1174646806770323250,https://www.airbnb.com/rooms/1174646806770323250,20240923040840,2024-09-23,city scrape,Urban Cocoon,Keep it simple at this peaceful and centrally-located place.,,https://a0.muscache.com/pictures/miso/Hosting-1174646806770323250/original/39ce394c-2fb4-4932-b241-a1d8f6e15fc0.jpeg,132578455,https://www.airbnb.com/users/show/132578455,Dimitris,2017-05-30,"Athens, Greece",,within an hour,100%,100%,f,https://a0.muscache.com/defaults/user_pic-50x50.png?v=3,https://a0.muscache.com/defaults/user_pic-225x225.png?v=3,,1,1,"['email', 'phone']",f,t,,ΠΕΤΡΑΛΩΝΑ,,37.96832469964383,23.711721915367903,Entire rental unit,Entire home/apt,3,1.0,1 bath,1.0,1.0,"[""Air conditioning"", ""Kitchen"", ""Washer"", ""Wifi""]",$40.00,1,365,1,1,365,365,1.0,365.0,,t,7,7,15,289,2024-09-23,2,2,2,2024-08-24,2024-09-02,3.5,3.0,2.5,4.0,4.5,4.0,3.0,00001458872,t,1,1,0,0,2.0
13537,1209209197348228166,https://www.airbnb.com/rooms/1209209197348228166,20240923040840,2024-09-23,city scrape,Modern Bright Home VIPGreece,"Welcome to your modern bright retreat in Athens! Our new stylish apartment combines modern elegance with homey comfort, making it the perfect choice for up to 4 guests. Whether you're a family, a group of friends, or business travelers, you'll enjoy an unforgettable stay in the heart of the city. <br /><br />Experience the best of Athens from this bright and beautifully apartment. Book now and make this chic apartment your home away from your home!",,https://a0.muscache.com/pictures/miso/Hosting-1209209197348228166/original/dc3a2c64-b55b-4859-a2b8-ac33919fcb8f.jpeg,189967864,https://www.airbnb.com/users/show/189967864,Αριστειδης,2018-05-16,"Palaio Faliro, Greece",,within an hour,99%,96%,f,https://a0.muscache.com/im/pictures/user/72e3134b-c146-48aa-9fb9-a3962f9d1397.jpg?aki_policy=profile_small,https://a0.muscache.com/im/pictures/user/72e3134b-c146-48aa-9fb9-a3962f9d1397.jpg?aki_policy=profile_x_medium,Larissis,65,68,"['email', 'phone']",t,t,,ΝΙΡΒΑΝΑ,,38.00601,23.72383,Entire rental unit,Entire home/apt,4,1.0,1 bath,1.0,2.0,"[""TV"", ""Shower gel"", ""Kitchen"", ""Wine glasses"", ""Stove"", ""Coffee maker"", ""Heating"", ""Body soap"", ""Crib - available upon request"", ""Washer"", ""Refrigerator"", ""First aid kit"", ""Iron"", ""Air conditioning"", ""Toaster"", ""Bed linens"", ""Dining table"", ""Hair dryer"", ""Cooking basics"", ""Hot water"", ""Microwave"", ""Clothing storage"", ""Drying rack for clothing"", ""Hot water kettle"", ""Shampoo"", ""Dishes and silverware"", ""Extra pillows and blankets"", ""Cleaning products"", ""Wifi"", ""Hangers""]",$60.00,1,365,1,1,365,365,1.0,365.0,,t,20,50,80,355,2024-09-23,1,1,0,2024-08-03,2024-08-03,4.0,4.0,2.0,5.0,3.0,3.0,3.0,00002800390,t,41,41,0,0,0.58
